Reason,PHate,Site,PostID,Title,Content,Comments,GalleryID,PostURL,Source,Keyword,Comment
Content Hate,0.9405299899728626,ARCALIVE,155217993,새 폰 삼,아이폰 16 프로로…… 지금까지 일반 쓰긴 했는데 카메라 ㅈㄴ 크네,새로운 폰세의 집은 삼성이라는 뜻인가 칩세임? ||| ? ||| 나 이재용인데 너 왜 아이폰 쓰냐,KBO,https://arca.live/b/breaking/155217993?target=all&keyword=%EC%95%84%EC%9D%B4%ED%8F%B0+16&p=1,arca,아이폰 16,
Comment Hate,0.904588045395962,,155167884,,,,,,,,ㅇㅇ 15/16은 카메라 빼곤 폼팩터 재탕임
Comment Hate,0.9201601040418198,,155108070,,,,,,,,밴웨이브 터졌을때 떡돌리러 올라온거 개웃겼는데 ㅋㅋ 소오콘 자체는 1주년때인가 찍먹만하고 접었음..
Content Hate,0.9310718569952836,DCINSIDE,22605,대충 튜토리얼 정도는 한거같은데 후기,"시작부터 한번 상큼하게 튕기고 시작했다 명일방주는 꽤 오래전에 접었음 한섭은 특사스때 접은거같고 중섭은 너무 자연스럽게 접혀서 기억이 안난다 맵 퀄리티가 아주 좋음. 난 아이폰 16 프로맥스, 모바일로 했는데도 발열이 크게 끌어올려지지않고 이정도 퀄리티를 뽑는건 모바일",,명일방주 엔드필드,https://gall.dcinside.com/mgallery/board/view/?id=endfield&no=22605,dc,아이폰 16,
Content Hate,0.9173681719512792,ARCALIVE,155049678,모바일 최저/권장 사양 기기,최저 컷이랑 같거나 약간 높은 것들 써둠 * 달린게 약간 높은 애들임 최저(스냅 855/디멘시티1000/A13) 갤럭시 S10 시리즈 갤럭시 노트 10 시리즈 갤럭시 A 시리즈 일부(ㅈㄴ 많아서 다 못 씀) 갤럭시 Z 폴드 *갤럭시 Z 플립 갤럭시 탭 S6 LG G8 ,"내가 궁금했던 것도 있었고 챈에 가끔 이걸로 겜 돌아갈까 보여서 써봄 ||| 내 A35야 넌 저런거 보면 안돼! 떼찌! ||| A34가 최저에 걸치던데 35면 가능하지 않나 ||| 아 최저에 걸치는게 아니라 최저보다 좀 높네 ||| 어 진짜 최소라도 돌아는 갈려나?  근데 난 폰은 문자 통화 카톡 웹서핑 블아 돌리는 정도면 충분해서 엔필 하려고 데탑 각잡고 맞춘거라  그래도 정보추 ||| 찾아보니까 돌아는 간다 정도일 것 같아 ||| 핸드폰은 되는데 베타키가 없으면 어캄? ||| 감사감사 ||| 에어 시리즈도 정리해조 ||| M1 칩 들어간 5세대 에어는 권장 사양 넘어가는데 4세대는 램 사양 충족 안되네  애매한 것들에 넣어둘게 ||| 우우 엔붕이 최신폰인데 왜 다운못하는거임? ||| S23 FE 인데 무리없이 될라나 ||| 아무래도 폰이라 아예 무리 없이는 불가능일듯 가능하면 폰은 일퀘 정도로 하고 패드나 컴으로 돌리는게 맞을 것 같아 ||| 하긴 요즘 원신이나 명조도 다그렇긴 하지 ||| 권장컷 ||| 8+gen1은 8gen1수준으로 언더클럭된 모델도있어서 s22도 권장사항에 걸칠수도 있긴함 ||| 오 이건 몰랐네 근데 S22 GOS 때문에 그 정도 퍼포먼스가 나오려나? ||| 뿔땩이 아니라면 지금시점에선 잘나옴 ||| 휴 내 노트10+ 결제용으론 쓸수 있겠군 ||| 16프맥인데 60프레임기준 원신은 중옵정도로 한시간정도는 매끄럽게 돌아가고, 명조는 중하옵정도에 30분도안되어서 쿨러안달면 드랍 체감될정도로 심하더라. 엔필도 쿨러달고만 해야할듯 ||| s25+인데 베타키가없어요 ||| 이럴줄 알고 내가 s25 샀지롱 ||| 나 s22인데........... 패드는 간신히 컷 맞췄네 ||| s22가 권장 마지노선임 ||| 퀀텀5인데 베타키부터 못 받긴 했네.. ||| 레트로이드나 ayn 꺼 8gen2 쓰는 핸드헬드로 돌리는 것도 괜찮을 거 같네 ||| 아이패드 에어 4세대인데 슬프다 ||| 결제용으로 켜지긴하겟구나 ||| 권장이 플립z4면 z3정도면 그냥저냥 괜찮으려나 ||| S22인데 안 돌아가려나 ||| 무조건 돌아감 S10시리즈가 최저잖아 ||| 신기한 최적화구만",명일방주 엔드필드,https://arca.live/b/breaking/155049678?target=all&keyword=%EC%95%84%EC%9D%B4%ED%8F%B0+16&p=1,arca,아이폰 16,
Comment Hate,0.8938950984678273,,155036946,,,,,,,,세팅도 배터리 최적화 아예 끄고 한거라
