Reason,PHate,PostID,Comment,Site,Title,Content,Comments,GalleryID,PostURL,Source,Keyword
Content Hate,0.9107943575755079,154549115,,ARCALIVE,통신株 핵심 키워드는?...SKT ‘무배당’ KT ‘해킹’ LGU+ ‘퇴직금’,"[디지털데일리 오병훈기자] 증권사들은 통신3사 실적 발표 이후 주가 향방을 어떻게 전망하고 있을까. 올해 3분기 통신사들은 3사3색, 희비가 극명한 실적을 보여줬다. 이에 따라 증권가에서도 각사 핵심 키워드를 중심으로 주가 변동성을 분석하고 나섰다. SK 텔레콤 주가를 두고는 실적 악화에 따른 ‘배당금’이 핵심 키워드로 지목됐다. KT 관련해서는 ‘해킹사태’를 꼽았다. LG 유플러스에 대해서는 희망퇴직에 소모된 비용 ‘퇴직금’이 키워드로 언급됐다. ◆“ SKT , 4분기도 무배당 가능성” 증권가는 SK 텔레콤의 배당 변동성에 주목했다. 실적 악화에 따른 배당 정책 급변이 향후 주가 등에 큰 영향을 미칠 것으로 분석했다. 실적 악화는 지난 4월 발생한 유심칩 데이터 유출 사고에 대한 가입자 보상안으로 매출 감소 및 비용 증가에 따른 것이다. SK 텔레콤의 2025년 3분기 연결 매출은 3조9781억원, 영업이익은 484억원을 기록했다. 각각 전년과 비교해 12.23%, 90.9% 감소한 수치다. 별도 기준으로는 영업손실 522억원, 당기순손실 2066억원으로 적자전환됐다. 실적 발표 직후 이어진 컨퍼런스 콜에서 김양섭 SK 텔레콤 최고재무책임자( CFO )는 “전례 없는 재무 실적 악화에 따라 불가피하게 3분기 배당을 시행하지 않기로 했다”며 “재무적 영향이 연간 지속되고 있지만 향후에는 배당을 재개할 수 있도록 최선을 다하겠다”고 말했다. SK 텔레콤은 지난해 4월 조정당기순이익의 50% 이상을 배당 및 자사주 매입·소각 등 주주환원하겠다는 정책을 공시했다. 이에 따라 해킹 사태 직후인 올해 2분기까지도 1주당 830원 배당을 결정해 예년과 같은 수준 배당 의지를 피력해왔다. 그러던 중 3분기 실적 악화를 이유로 배당을 실시하지 않기로 결정한 것이다. 이에 컨퍼런스콜에서 일부 애널리스트는 “일회성 비용이 발생할 때마다 배당 감소가 있을 수 있냐”는 질문을 던지며 배당 불확실성 우려를 드러내기도 했다. 실적발표 직후 발간된 기업보고서에서도 배당 불확실성 우려가 핵심 고려 사항으로 언급됐다. 김홍식 하나증권 연구원은 “이론적으로 연결 기준 배당 성향 50%를 적용한다면 내년 배당 지급 가능액이 5500억원에 불과하고 주당배당금( DPS )으로 환산하면 2600원 수준”이라며 “배당 성향이 50% 수준에 머문다면 SK 텔레콤 주가 상승을 기대하기는 어렵다”고 짚었다. 안재민 NH 투자증권 연구원은 “올해 4분기도 배당하지 못할 가능성이 크다”며 “ SK 텔레콤 연간 배당금은 1630원으로 이 경우 올해 배당수익률은 3.1%에 불과해 경쟁사 절반 수준”이라고 분석했다. ◆“ KT , 해킹사태 이후 리스크 향방에 달렸다” KT 에 대한 증권가 관심은 지난 8월 발생한 해킹사태에 쏠려있다. 해킹사태 이후 4개월이 지나가고 있지만 경찰과 민관합동조사단 조사는 여전히 진행 중이다. 그 과정에서 2만2227명 이용자에 대한 정보 유출이 확인됐으며 이중 360여명 피해자를 대상으로 2억4000여만원 금전 피해가 발생한 것으로 나타났다. KT 에서는 피해자에 한해 위약금 면제 및 피해금액 전액 변제 등 사태 수습에 나선 상황이다. 전 가입자를 대상으로는 유심교체 등을 진행하고 있어 추가 비용 등이 발생할 것으로 예상된다. 다만 증권가는 이번 해킹사태와 관련해 완전히 새로운 추가 피해 등이 나타나지 않는다면 실적 영향은 미미할 것이란 관측을 내놨다. SK 텔레콤과 비교해 일부 가입자만 유출됐기 때문에 보상 범위도 제한되고 그에 따라 지출되는 일회성 비용도 적을 것이란 분석이다. 3분기 KT 실적도 좋았다. KT 는 3분기 연결기준 매출 7조1267억원, 영업이익 5382억원을 기록했다고 7일 밝혔다. 전년 동기보다 매출은 7.1%, 영업이익은 16% 증가했다. 부동산 사업 이익이 호조세를 보인 덕분이다. 본업인 통신 사업도 양호한 성적을 낸 덕에 별도 매출도 5조 1090억원을 기록했다. 전년 동기보다 7.2% 증가했다. 별도 영업이익은 0.6% 증가한 3409억원이다. 김회재 대신증권 연구원은 “ KT 해킹사태 경우 일부 가입자 정보만 유출됐다”며 “ SK 텔레콤 침해사고가 발생한 지난 4월 이후 KT 와 LG 유플러스 고객들도 상당 부분 유심 정보보호 서비스에 가입한 것으로 알려져 유심 교체 수요는 많지 않을 것”이라고 전망했다. 여전히 남아 있는 리스크들을 유의해야 한다는 의견도 있다. 정부의 해킹사태 조사과정을 방해한 혐의로 경찰 압수수색까지 벌어진 상황이다. 기업 신뢰 저하는 물론 향후 개인정보보호위원회 등 당국으로부터 과징금 규모에 영향을 미칠 수 있는 부분이다. 최민하 삼성증권 연구원은 “4분기에는 유심 무료 교체 비용을 영업 비용으로 인식할 것으로 예상되고 규제 기관의 조사 결과에 따른 잠재적 과징금 등이 반영될 여지가 있다”고 내다봤다. ◆“ LGU +, 일회성 비용 털고 반사이익으로 ‘턴어라운드’” LG 유플러스 기업 보고서에서 공통적으로 발견된 키워드는 ‘퇴직금’이다. LG 유플러스는 지난 7월 3년만의 희망퇴직을 실시했다. 비용효율화를 위해 인건비 등 계속비용을 최소화하겠다는 전략이다. 이때 지급된 퇴직금 이 이번 3분기에 반영되면서 영업이익 감소를 기록했다. LG 유플러스는 3분기 매출 3조1166억원, 영업이익 1617억원을 기록했다. 전년보다 매출은 4.2% 증가한 반면 영업이익은 희망퇴직에 따른 일회성 비용의 반영으로 34.3% 감소했다. 증권가에서는 이번 퇴직금 반영을 긍정적인 요소로 해석했다. 비용효율화에 투입된 일회성 비용으로 향후 실적 개선이 본격화될 것이라는 분석이다. 희망퇴직에 소요된 1500억원을 제외하면 3분기 영업이익은 지난해 같은 기간 대비 26.7% 늘어난 3117억원을 기록했다는 것이 LG 유플러스 측 설명이다. 김태현 IBK 투자증권 연구원은 “희망퇴직 영향으로 3분기 수익성이 일시적으로 저하 됐지만, 내년엔 약 500억원 인건비 절감 효과가 반영될 것”이라며 “연간 영업이익은 1조1590억원으로 24.5% 증가할 전망”이라고 설명했다. LG 유플러스는 SK 텔레콤과 KT 의 해킹사태로 지속적으로 가입자 성장을 통한 반사이익을 누릴 수 있었던 점도 실적 개선 전망 요인으로 꼽힌다. LG 유플러스의 3분기 이동통신과 알뜰폰를 합한 전체 무선 가입 회선 수는 3025만9000개로 전년 동기보다 8.6% 늘었다. 모바일 매출도 전년 대비 5.6% 증가한 1조7114억원을 달성했다. 통상 매출 증가율이 2%인 점을 감안하면 이례적인 성장이란 분석이다. 이찬영 유진투자증권 연구원은 “3분기 모바일 서비스 수익이 전년 같은 기간 대비 5.2% 성장했다”며 “앞으로도 가입자 증가에 따른 매출 성장이 장기적으로 기대된다”고 내다봤다.",국장배당주는 진짜 안사야지...,stock,https://arca.live/b/stock/154549115?target=all&keyword=%EC%82%BC%EC%84%B1&p=2,arca,삼성
Content Hate,0.9018006700402343,154536137,,ARCALIVE,아이폰 이제 영포티의 시대 ㄷㄷㄷ,40대 갤럭시 유저가 아이폰으로 이탈하는 현상 발생중 아무래도 아이폰이 젊음의 상징 + 여태까지 삼성만 써봤으니 아이폰 갈아타볼까 심리? 젊은 남성들은 기능성 때문인지 갤럭시로 가는 방향을 보이고 있고 여전히 젊은여성은 애플 선호 (조카도 여자인데 아이폰 아니면 안된다드라) 뭣... 재드래건과 인터뷰 할 수 있는 기회를 버린다고!?,내 개인적인 경험이 갤럭시 가기 힘든것도 잇음 아이폰 13플러스인데 나 핸드폰 오래 붙잡으면서 안뜨거워지는거 처음임 갤럭시는 진짜 어느순간부터 뜨거워지더니 전화 끊고나면 땀이 뭍어잇더랑... ||| 노트북경험도  지금 맥북프로랑 삼성갤북 가지고 잇는데 맥북프로는 연식이 3년정도됏고 삼성갤북은 1년됨 삼성 갤북 지금 못쓰고 잇음  켜기만해도 불덩이임 이게 이번만 그랫냐?  그 전 모델에서도 그랫음 맥북은 진짜 발열 너무 적어서 좋음 삼성 노트북은 좀 몇시간 정도 쓰면 키보드도 뜨거워지는 순간이 오곤햇는데 ㅋㅋㅋㅋ ||| ㅇㅎ 발열 은근히 심하긴함 나도 오랫동안 갤럭시로 겜 하면 손가락 지문이 화끈 거리더라 ㅇㅇ ||| 정말 그게 제일 힘든부분이엇음 ㅋㅋ 갤럭시 이번에 AI관련해서도 기능 좋던데.... 노트북이든 폰이든 발열만 어떻게 해주면 진짜 넘어가겟는데 말이야 ||| as만 어떻게 하면 아이폰 갈텐데 말야,stock,https://arca.live/b/stock/154536137?target=all&keyword=%EC%82%BC%EC%84%B1&p=2,arca,삼성
Content Hate,0.9368493305196554,154498393,,ARCALIVE,중일갈등 UFC 시나리오 추천 종목 분석,"중국 입장에서 진짜 아픈 일본 소부장은 ① 포토레지스트(감광액) / 포토공정용 화학물질 ② 300mm 실리콘 웨이퍼 ③ 포토마스크 블랭크(EUV 포함) ④ CMP 슬러리·패드, 고순도 특수가스 일부 ⑤ 패키징용 ABF필름 이 정도고, 이 중에서 한국이 현실적으로 대체 수출을 노려볼 만한 건 ①·③·④·특수가스 일부입니다. **불화수소(HF)**는 구조가 조금 특이해서, “중국 → 일본 → (정제) → 한국/기타” 흐름이 강합니다. 중국이 일본에 HF를 안 주면 일본이 더 곤란하고, 일본이 중국에 HF를 막는 시나리오는 영향이 상대적으로 작아요. 아래에서 품목별로 일본 점유율과 중국 의존도 → 한국 대체 여력 → 관련 ‘대장주 후보’를 같이 묶어서 보겠습니다. 1. 중국이 일본에 많이 의존하는 핵심 소부장 & 점유율 1) 포토레지스트·포토공정 화학(감광액) 일본의 글로벌 포지션 Shin‑Etsu, JSR, Tokyo Ohka Kogyo(TOK), Fujifilm 등 **4개 일본 업체가 전 세계 포토레지스트 시장의 87%**를 차지합니다. 사실상 선진 노드(ArF, EUV) 포토레지스트는 거의 일본·미국 일부 독점 구조. 중국의 일본 의존도 중국의 ‘감광성 화학품(Photographic chemicals)’ 수입에서 2023년 일본 비중 52.8%(11.49억 달러 / 21.77억 달러) 2024년 상반기에도 일본 비중 51.5% 수준 유지. 같은 품목에서 **한국 비중도 빠르게 올라와 2024년 기준 6.65억 달러(대략 25~30%)**까지 증가. 중국 내 포토레지스트 국산화: KrF 기준 국산화율 5% 미만, ArF는 1% 미만 수준으로 평가됩니다. 일본이 중국으로 포토레지스트 수출을 끊으면 중국은 단기적으로 꽤 큰 타격이고, 대체 공급원으로 한국·대만·미국을 강하게 찾아갈 가능성이 높습니다. 2) 실리콘 웨이퍼 (특히 300mm) 일본의 글로벌 점유율 Shin‑Etsu + SUMCO → 글로벌 실리콘 웨이퍼 시장 53% 점유. 300mm 웨이퍼에서도 두 회사와 GlobalWafers(대만)가 거의 시장을 나눠 먹는 구조. 중국의 일본 의존도 중국은 300mm 웨이퍼에서 여전히 수입 의존도가 높고, 그 중 상당 부분이 일본산으로 추정됩니다(정확한 %는 공개 통계가 거의 없음). 중국 로컬 웨이퍼 업체도 있지만, 고품질·고직경 웨이퍼는 일본·대만·한국 의존 구간이 여전히 큼. 웨이퍼는 일본이 빠질 경우 공백이 크지만, 한국 혼자 다 메우기는 물량·CAPEX 측면에서 쉽지 않은 영역입니다. 3) 포토마스크 블랭크(EUV/DUV) 일본의 글로벌 점유율 HOYA가 포토마스크 블랭크 시장 60~80% 수준을 장악, AGC 등도 일본 업체. EUV 마스크 블랭크는 사실상 일본+일부 대만/한국 수준의 초집중 구조. 중국의 일본 의존도 고급 마스크 블랭크는 현실적으로 일본 의존도가 매우 높다고 보는 게 합리적입니다(수치 공표는 거의 없음). 일본이 중국에 마스크 블랭크를 끊으면, 중국은 중·저급 노드는 버티더라도 EUV/미세공정 확장은 크게 지연될 가능성이 큼. 4) CMP 슬러리·패드, 기타 공정 재료 일본의 글로벌 점유율 Fujifilm은 구리 배선용 CMP 슬러리에서 세계 1위로 소개되고, 일본 Fujimi 역시 CMP 마켓의 핵심 플레이어로 언급됩니다. AMRO 자료에서도 일본이 CMP 슬러리·패드, 가스·케미컬 분야 전체에서 강한 수출 허브로 표시됩니다. 중국의 일본 의존도 세부 품목별 수입 점유율이 모두 공개된 건 아니지만, 고급 CMP 소재는 일본·미국·한국 소수 업체에 집중되어 있는 구조라 일본이 빠지면 구멍이 생깁니다. 5) 특수가스 (HF, NF₃, 플루오르 계열 가스 등) HF(불화수소)의 특이한 구조 글로벌 원재료 HF는 중국이 압도적인 수출국이고, 일본은 여기를 수입해서 고순도 HF로 정제한 뒤 주로 한국 등으로 재수출합니다. 2018년 기준 분석을 보면, 중국은 HF 수출에서 중심 국가, 일본은 HF의 99%를 중국에서 수입해 정제 후 한국으로 수출하는 구조가 확인됩니다. 즉 “일본 → 중국으로 HF 공급”은 상대적으로 작은 축이고, 오히려 “중국 → 일본” 의존이 더 큼. 기타 고순도 에칭/클리닝 가스 NF₃, SF₆ 등 고순도 에칭 가스 시장은 SK Materials(한국), Kanto Denka, Taiyo Nippon Sanso(일본), Linde/Air Liquide(유럽) 등이 경쟁하는 구조입니다. 중국 수요는 크지만 특정 국가 한 곳에만 과도하게 의존하는 그림은 아닙니다. HF 자체는 중국이 더 강한 쪽이고, 일본이 중국 수출을 끊어도 충격은 제한적일 가능성이 큽니다. 대신 NF₃, 고순도 플루오르 계열 가스에서 일본이 빠지면 공정 최적화 측면에서 공백이 생길 수 있습니다. 6) 반도체 장비 (Coater/Developer, Cleaning, Tester, Lithography 등) 일본의 글로벌 점유율 일본 기업이 반도체 제조 장비 글로벌 시장 약 30% 점유. Tokyo Electron + SCREEN → Coater/Developer(도포·현상 장비) 88%, 웨이퍼 세정 장비 57% 점유. Advantest → 테스트 장비 시장 58%. 노광장비 시장은 ASML(네덜란드) 약 62%, Canon 31%, Nikon 7% (주로 i-line/KrF 등 중저가 노드). 중국의 일본 장비 의존도 2019년 기준 분석에서, **중국의 반도체 생산장비 수입 중 일본·미국·네덜란드 3국이 52%**를 차지합니다. 최근 조사(TrendForce 요약)에선 **2017~2024년 중국의 반도체 장비 수입에서 일본 비중이 평균 약 32%**로 추정됩니다. 일본이 장비 수출을 끊으면, 중국은 EUV는 어차피 ASML 의존, 그러나 중저가 노드용 노광/코터·디벨로퍼·세정/테스트 장비에서 꽤 큰 공백이 생깁니다. 7) 패키징용 ABF( Ajinomoto Build‑up Film ) Ajinomoto가 CPU·GPU용 ABF 재료 시장 95% 이상 점유. 고성능 패키지(FC-BGA 등) substrates 대부분이 Ajinomoto의 ABF에 의존. 일본이 중국향 ABF 공급을 끊으면 고성능 패키징 라인에 직접적인 타격이 들어갑니다. 단, 중국·대만의 substrate 업체들이 재고와 대체 소재를 어느 정도 개발 중이라 영향은 시차를 두고 나타날 가능성. 2. 요약: 일본이 막으면 중국이 진짜 아픈 품목 순위 포토레지스트·포토공정 화학 포토마스크 블랭크(EUV 포함) 300mm 실리콘 웨이퍼 CMP 슬러리·패드 / 고순도 특수가스 일부 ABF 패키징 소재 중저가 노드용 일본 장비 (Coater/Developer, Cleaning, Tester 등) HF(불화수소) 자체는 역으로 일본이 중국에 더 의존 3. 한국이 대체 수출하기 좋은 영역 & 관련 대장주 후보 아래 종목들은 테마/공급망 관점에서 대표 상장사를 정리한 것이고, 투자 추천이 아니라 정보 제공이라는 점은 꼭 전제로 둘게요. (A) 포토레지스트·포토공정 화학 한국의 강점 중국의 Photographic chemicals 수입에서 한국 비중이 이미 25~30% 수준까지 올라온 상태. 한국 기업들이 ArF/KrF 포토레지스트, 포토 현상액, 스트리퍼, 세정액까지 포트폴리오를 갖추고 있고, 일부는 EUV 레지스트 R&D 및 양산 준비 단계까지 와 있습니다. 대체 수출 유망 품목 KrF/ArF 포토레지스트 (특히 미세공정 전 단계·중저가 노드) 포토 공정용 현상액·스트리퍼·세정액 등 대표 한국 상장사 동진쎄미켐(005290, KOSDAQ) 포토레지스트(ArF, KrF, i-line), CMP 슬러리, 전해동도금액 등 포토·배선 일괄 라인. 삼성·SK향 비중이 크고, 미국·중국향 수출도 확대 중. ENF테크놀로지(102710, KOSDAQ) 포토 공정용 현상액, 스트리퍼, 에천트, 포토레지스트용 모노머·폴리머·PAG 등 원재료까지 공급. (보조) 솔브레인, SK머티리얼즈 계열, 기타 일부 케미컬 업체도 포토 공정 세정·에천트에 포트폴리오를 보유. 단기중기(15년) 기준으로 보면, 포토레지스트/포토 화학은 한국이 일본 공백의 상당 부분을 가져올 수 있는 1순위 품목입니다. 다만, EUV용 최첨단 레지스트는 여전히 일본·미국 우위라, 중국 수요를 전부 가져오기엔 기술·규제 한계가 있다는 점은 감안해야 합니다. (B) 고순도 에칭/클리닝 가스 (HF 계열, NF₃, 플루오르 가스) 한국의 강점 SK Inc. Materials(구 SK머티리얼즈) NF₃ 등 특수가스에서 글로벌 상위권, NF₃ 시장 점유율 40% 안팎으로 평가됩니다. 솔브레인(036830, KOSDAQ) 고순도 불산(HF), BOE, 박막 식각용 화학, CMP 슬러리 등 정밀화학 강자. 후성(093370, KOSPI) 고순도 HF, WF₆, C4F6 등 첨단 에칭·증착 특수가스 포트폴리오. 원익머티리얼즈(104830, KOSDAQ) NH₃, N₂O, PH₃ 혼합가스 등 반도체용 특수가스 전문. 일본이 중국에 특수가스 수출을 줄이면, 중국은 한국·유럽(린데·에어리퀴드) 쪽으로 더 큰 물량을 주문할 가능성이 큽니다. 다만 HF는 여전히 중국 자체 공급력이 상당히 강하고, 일본이 아닌 중국·한국·대만 위주로 재편될 공산이 큽니다. (C) CMP 슬러리·패드·세정 장비 한국의 강점 솔브레인 CMP 슬러리, 박막 식각 화학, 세정액 등에서 포트폴리오 확대, 국내뿐 아니라 해외(미국 텍사스 등)에 정밀 화학 공장 투자 진행. KCTech(281820, KOSPI) CMP 장비 + 웨이퍼 세정 장비 + CMP 슬러리(소재)까지 동시에 제공하는 회사. FNS테크(083500, KOSDAQ) CMP 패드 전문업체. ENF테크놀로지 CMP 슬러리도 생산, 포토·에천트와 함께 세트로 공급 가능. 일본이 CMP 소재 공급을 줄이면, 중국은 당장 미국(케맥스 등)과 한국 업체로 발주를 분산시킬 가능성이 높습니다. CMP는 “레시피 튜닝”이 중요해서 전환 비용이 크지만, 중장기적으로는 한국 쪽으로 상당 부분 이동할 수 있는 영역입니다. (D) 포토마스크 블랭크(EUV 포함) 한국의 강점 S&S Tech(101490, KOSDAQ) 한국 최초로 반도체용 포토마스크 블랭크 국산화, 2023년 TSMC와 5년간 EUV 블랭크 마스크 1,200만장 공급 계약 체결. 삼성과도 EUV 관련 공동 특허(EUV 펠리클 프레임) 출원 등 협력 확대. 일본(HOYA·AGC) 의존도가 워낙 높아서 단기엔 공백이 크겠지만, 중기(3~7년) 관점에선 한국 S&S Tech가 비일본 공급자로서 존재감이 크게 커질 수 있는 포지션입니다. 테마 관점에서 EUV 블랭크·펠리클 국산화 = S&S Tech로 보셔도 무방해요. (E) 실리콘 웨이퍼 한국의 강점과 한계 SK실트론(비상장, SK Inc. 자회사) 글로벌 300mm 웨이퍼 시장에서 Top5, 대략 10%대 점유율, 300mm 캐파 기준으로 15% 수준까지 추정됩니다. 중국향 공급 경험도 있고, 전력반도체용 SiC 웨이퍼도 확대 중. 상장 관점에선 **SK Inc.(034730, KOSPI)**가 SK실트론 지분을 보유하고 있어서 → 웨이퍼 테마를 간접적으로 담는 대장주 포지션으로 볼 수 있습니다. 다만 일본이 웨이퍼 53%를 쥐고 있는 상황이라, 한국이 중국 수요까지 한 번에 받기엔 CAPEX·리드타임 제약이 큽니다. 웨이퍼는 중장기(5년 이상) 투자·증설 관점에서 서서히 일본 의존도를 낮추는 영역 정도로 보는 게 현실적입니다. (F) 반도체 장비 (일본 공백 일부 대체) 일본 장비를 “완전히 대체”하긴 어렵지만, 세정/에칭/증착/열처리 등 전공정 장비는 이미 한국 업체가 글로벌 레퍼런스를 꽤 확보한 상태라 일부 수요를 가져올 여지가 있습니다. 대표 한국 장비 업체들: 원익IPS : 증착·식각·열처리 장비 주성엔지니어링 : 증착·태양광·OLED 등 PSK : 애시·세정 장비 KCTech(281820) : CMP 시스템·세정 시스템 (비상장) SEMES : 삼성 계열 1위 장비사 일본 Tokyo Electron·SCREEN·Advantest의 공백을 한국이 전부 가져가긴 어렵지만, 중저가 노드·국산화 니즈가 있는 중국 팹을 대상으로는 SMIC 이하 계열에서 한국 장비 입지가 늘어날 수 있는 구조입니다. 4. 시간축으로 본 한국의 대체 수출 여지 단기 (1~3년) 포토공정 화학 (현상액·세정액·스트리퍼 등) 일부 포토레지스트 (KrF/성숙 노드) 특수가스 (NF₃, 플루오르 가스, 고순도 HF 등) CMP 슬러리·패드 이미 중국에 수출 경험 + 생산 캐파가 준비된 한국 업체가 많아서, 정치·규제만 허용된다면 일본 몫의 일부를 즉시 흡수할 수 있는 영역입니다. 중기 (3~7년) EUV 제외 포토레지스트 비중 확대 CMP 소재·장비의 중국 내 점유율 확대 포토마스크 블랭크(EUV 포함)에서 S&S Tech의 비중 확대 일부 전공정 장비(세정, 애시, 열처리 등)의 일본 대체 중국이 일본 의존을 줄이려고 할 때, “일본 → 한국·대만·유럽”으로 공급망이 재편되는 구간입니다. 장기 (7년 이상) 300mm 실리콘 웨이퍼 공급 재편 ABF 대체 소재 개발/상용화 (현재는 일본 Ajinomoto 독주) 일부 장비 분야에서 한국이 완전 독자 제품 라인업 구축 이 단계는 막대한 CAPEX와 긴 검증 기간이 필요하기 때문에, 한국 혼자 보기보다는 글로벌 파운드리(삼성·TSMC·미국 팹)와의 조합 속에서 풀릴 가능성이 큽니다. 5. 한중일 갈등 시 한국 소부장에 대한 현실적인 시각 포토레지스트·포토 화학 + 특수가스 + CMP → 한국이 단기·중기 모두 일본 공백을 상당 부분 채울 수 있는 스윗스팟 → 동진쎄미켐, ENF테크놀로지, 솔브레인, SK Inc.(머티리얼즈), 후성, 원익머티리얼즈, KCTech, FNS테크, ENF 등이 자연스럽게 테마 중심에 들어갑니다. 포토마스크 블랭크(EUV) → 일본 의존도가 워낙 높아서, S&S Tech 같은 한국 업체의 전략적 가치가 크게 부각될 수 있는 영역. 웨이퍼·장비 → 한국이 수혜를 보더라도 대만·유럽(ASML, GlobalWafers 등)과 나눠 갖는 구조가 될 가능성 높음. → 웨이퍼는 SK실트론(비상장) → SK Inc. 간접, 장비는 Wonik IPS·주성·PSK·KCTech 등 분산. 정치·규제 변수 현실 세계에선 미국 주도의 수출 통제(Chip4 연합) 때문에 한국이 중국에 너무 과도하게 고급 소부장을 공급하는 건 또 다른 리스크가 됩니다. 그래서 “한국이 일본의 빈 자리를 전부 가져간다”기보다는 **“일본 비중 일부 감소 → 한국·대만·유럽이 나눠 가져가는 구조”**로 보는 게 더 현실적입니다.",,stock,https://arca.live/b/stock/154498393?target=all&keyword=%EC%82%BC%EC%84%B1&p=2,arca,삼성
Comment Hate,0.8655345659147856,154468582,새가슴이라 하닉스퀘어만 분할매수로 물타는중... 10주살때마다 대가리에서사서 평단만원씩내려가네 ㅋㅋㅋ,,,,,,,,
Comment Hate,0.9291297391947952,154456405,키옥시아는 돈안되는 B2C 낸드라서 키옥시아 안된다고 B2B 낸드 기업들까지 건드릴 필요가 없는데 그냥 죄다 내려버림 지금 하이닉스 쳐맞고 있는건 엔비디아가 HBM 수요에 대해 구라 약간 섞은거 아니냐는 의심을 직격타로 맞고 있는 건데 글쎄다...싶음,,,,,,,,
Comment Hate,0.8652710689270027,154456405,근데 그렇다고 하기에는 마이크론도 같이쳐맞았음 램리서치도.. 솔직히 그냥 이유따윈 없고 일단 섹터별로 돌아가며 때리다가 구실을 만들어내는거같아보임,,,,,,,,
Comment Hate,0.9388903107226044,154456405,ㅇㅇ 그러니까 하락의 이유가 명확하지 않은 거임. 그냥 매도하는 중임,,,,,,,,
