Reason,PHate,PostID,Comment,Site,Title,Content,Comments,GalleryID,PostURL,Source,Keyword
Content Hate,0.8612346634418386,154747214,,ARCALIVE,[단독]마스가 참가 조선사 '크리스마스'에 윤곽... 트럼프 SNS에 주목,"사업 제안서를 접수 받아, 운용과 투자 계획 살펴본 뒤 최종 낙점 [파이낸셜뉴스]도널드 트럼프 미국 대통령이 야심차게 준비 중인 한미 조선협력을 위한 '마스가( MASGA· 미국 조선업을 다시 위대하게)' 프로젝트가 크리스마스 전후로 윤곽이 드러날 전망이다. 미국 상무부는 이달 내 한국 기업들로부터 사업 제안서를 접수 받아, 마스가 프로젝트 운용과 투자 계획 등을 살펴본 뒤 파트너를 최종 낙점한다는 계획이다. 이에 따라 기업들도 군함과 잠수함, 무인기술 등 자사가 보유한 강점등을 앞세워 사업 지분 확보를 늘리기 위한 치열한 경쟁이 예고된다. 23일 파이낸셜뉴스의 취재를 종합하면 복수의 마스가 프로젝트에 정통한 인사들은 트럼프 대통령이 이르면 크리스마스를 디데이로 마스가 성과를 자신의 SNS 를 통해 알리겠다는 계획을 세우고 있다고 전했다. 관련 업계 관계자는 “트럼프 행정부가 새해 첫해인 1월 1일 확정도 고민했으나, 우선적으로 크리스마스를 목표로 삼은 것으로 안다”면서 ""이에 맞춰 미국 상무부가 각 기업들에게 최근 사업제안서 제출을 요구한 것으로 안다""고 전했다. 앞서 지난 13일 알렉스 크루츠 미국 상무부 부차관보를 비롯한 미국 상무부 대표단이 한국을 찾아 HD 현대중공업, 삼성중공업, 한화오션, HJ 중공업 등 국내 주요 조선사들을 둘러본 점 역시 조만간 마스가 프로젝트가 베일을 벗을 것이란 전망에 힘이 실린다. K- 조선의 주축이 되는 마스가는 미 해군 군함 선조와 최근 트럼프 대통령이 승인한 핵추진 잠수함 건조, 미 해군 군함의 유지·정비·보수( MRO ) 사업이 주가 될 것으로 관측된다. 각각의 사업을 두고 한 업체가 독식하는 방식이 아닌, 컨소시엄 방식으로 지분에 따른 수익을 나누는 방식으로 진행될 것으로 알려졌다. 조선업계 관계자는 ""마스가 관련 투자는 한 두 기업의 독점 형식이 아닌 복수의 기업이 참여하는 방식이 될 전망""이라면서 ""이를 위해 조금이라도 더 예산을 따내기 위한 각 조선사별 경쟁이 막판까지 치열한 상황""이라고 분위기를 전했다. 김정관 산업통상부 장관은 지난 한미 양국이 지난 14일 정상회담 팩트시트(공동 설명자료)를 설명하는 자리에서 ""1500억달러 규모의 마스가 펀드에서 나오는 모든 수익은 미국과 나누지 않고 100% 한국 기업에 귀속될 예정""이라며 ""미국 정부는 조선 분야 투자에 토지 임대와 용수·전력 공급 등에 노력한다는 내용도 MOU 에 담겼다""고 설명한 바 있다. 기존 반도체 등 국가전략산업 유치를 위해 베트남 등에서 투자유치를 하는 방안과 유사한 방식이다. 한국 기업들에게 유리한 방식으로, 달라진 K- 조선의 위상을 확인할 수 있는 부분이다. 마스가 프로젝트 지분 확보가 수익성으로 직결되는 만큼, 기업들의 치열한 경쟁도 예고된다. 특히 MRO 사업과 미 해군 군함 건조 사업 수주가 기대됐던 초반과 달리, 최근 핵추진 잠수함 건조가 새로운 이슈로 떠올랐다. 조선업계에서는 총 23척의 잠수함을 수주하며 '잠수함 명가'로 불리는 한화오션이 키를 쥘 것으로 관측되는 가운데, 총 7척의 잠수함 제작 노하우를 가진 HD 현대중공업도 잠수함 건조에 공을 들일 것으로 보고 있다. HD 현대중공업과 한화오션은 현재 60조원 규모의 캐나다 잠수함 사업에 원팀으로 참가해 지난 8월 숏리스트(적격후보)에 이름을 올리고 최종 결과를 기다리고 있다.",,stock,https://arca.live/b/stock/154747214?target=all&keyword=%EC%82%BC%EC%84%B1&p=2,arca,삼성
Content Hate,0.8999583402827175,154712285,,ARCALIVE,누가 국장 올인한다길래,"월요일 국장 풀매수할거임 내 위험 분석 깡통에다가 국장 데이터를 넣고 분석을 시킴. KOSPI 변동성 기반 시장 위험 분석 보고서 (데이터: KOSPI Volatility 과거 데이터, 2025-10-23 ~ 2025-11-21 / 코스피200 옵션 체인 스냅샷·주요 글로벌 뉴스 기반) 1. KOSPI 변동성 지표 분석 1-1. 지표 개요 및 현재 수준 데이터는 **KOSPI Volatility Index(KSVKOSPI)**의 2025-10-23 ~ 11-21 종가 시계열입니다. 같은 지수의 실시간 페이지에 따르면 11월 21일 종가는 41.38 포인트, 시가는 40.70포인트로 확인됩니다.( Investing.com ) 제공된 22거래일 데이터를 기준으로 한 통계: 기간 평균: 35.9 최저: 30.4 , 최고: 41.9 11월 21일 종가 41.38은 상위 약 95퍼센타일 수준(22개 중 21번째로 높음) 평균 대비 z-score ≈ +1.5σ (평균보다 약 1.5표준편차 높은 수준) 10월 23일(30.63) → 11월 21일(41.38)로 약 +35% 상승 해석 10월 말의 30pt 초반은 “약간 높지만 평온한(risk-on~중립)” 구간에 가깝고, 40pt 초반 은 과거 경험상 “조정 국면 혹은 이벤트 리스크가 반영된 구간”으로 보는 경우가 많습니다. 짧은 표본이지만, 최근 한 달 사이 KOSPI 변동성은 ‘저-중 정도’에서 ‘고’ 구간으로 계단식 점프 를 한 상태입니다. 1-2. 단기 추세(5일 기준 모멘텀) 5일 이동평균은 38.2 수준인데, 현재 값 41.38은 이보다 약 8% 상회 합니다. 11월 중에 ±10% 이상 일일 변동 이 여러 번 나오면서(예: +14.26%, -7~-8% 구간) 변동성 자체가 “점프형”으로 움직이고 있습니다. 해석 단기적으로 변동성은 **상승 추세(Uptrend)**에 있으며, 최근 상승폭이 이동평균을 크게 상회하는 것으로 보아 “ 공포가 급격히 쌓이는 초입 단계 ”에 있다는 시그널로 볼 수 있습니다. 다만, 아직 50~60pt 같은 “공포 피크(패닉)” 레벨까지는 가지 않았기 때문에 ‘높은 긴장 상태이지만 시스템 리스크 급발생 국면은 아님’ 정도로 평가할 수 있습니다. 2. 옵션·글로벌 지표로 본 추가 위험 신호 2-1. 코스피200 선물·옵션 체인 한국경제 코스피200 옵션 페이지 기준 코스피200 선물 가격은 541.29pt, 일간 -4.37% 급락 으로 표기됩니다. 같은 만기(2025년 12월) 옵션 체인에서: 전 구간에 걸쳐 풋옵션 가격이 전일 대비 큰 폭 상승 한 행들이 다수 보이고, 일부 OTM(기준가보다 낮은 행사가) 풋에서는 수천 포인트(원 단위) 단위의 상승 과 함께 거래가 발생한 것이 보입니다. 해석 당일 선물 -4%대 급락과 풋옵션 전반의 가격 점프는 하방 헤지 수요 확대 , 혹은 이미 쌓여 있던 풋 포지션의 가치 급증(수익 실현 가능 구간 진입) 을 의미합니다. 선물 급락 + KOSPI 변동성 지수 40pt 초반은 “가격 조정 + 변동성 랠리”가 동시에 진행 중 이라는 전형적 패턴입니다. 2-2. 글로벌 변동성(VIX) 및 KOSPI vs 글로벌 스프레드 CBOE VIX(미국 S&P500 변동성 지수)는 11월 중순 이후 20 근처 → 26선 이상 으로 급등, 11월 21일 기준 종가는 약 25.97 로 집계됩니다.( Yahoo Finance ) 여러 기사에 따르면 이번 VIX 스파이크는 AI 버블 우려 , 미국 기술주 밸류에이션 부담, 지정학(특히 중동 관련 긴장) 등이 복합적으로 반영된 결과로 해석됩니다.( Financial Times ) 블룸버그는 Kospi 200 Volatility Index(VKOSPI)가 4월 관세 쇼크 때 수준으로 급등 , VIX와의 스프레드(한국 vs 미국 변동성 차이)가 2004년 이후 가장 넓은 수준 에 근접해 있다고 분석합니다.( mint ) 해석 미국도 “평온”에서 “긴장”으로 변동성이 점프했지만, 한국은 그보다 한 단계 더 높은 긴장 상태 에 있습니다. VKOSPI > VIX + 역사적 최대 수준 스프레드라는 것은 한국 주식의 고평가·레이징 랠리(올해 +60~70%)에 대한 경계 , 레버리지·옵션을 활용한 공격적 베팅이 많았다는 점 , 조정이 시작되자마자 헷지/청산 수요가 한꺼번에 몰렸다는 점 을 시사합니다. 2-3. KOSPI 지수·실제 변동성(GARCH 추정치) 11월 21일 기준 KOSPI는 전일 대비 -3.79% 하락, 최근 급락들로 외국인 자금이 한 주 동안 50억 달러 이상 순유출 된 것으로 집계됩니다.( Korea Joongang Daily ) NYU V-Lab의 GARCH 모형은 11월 24일 KOSPI 일간 변동성을 36.47% (+3.58%p) 수준으로 예측하며, 최근 몇 달 사이 가장 높은 밴드에 근접한 것으로 나타납니다.( vlab.stern.nyu.edu ) 해석 통계 모델 관점에서도, 최근 변동성은 **평균을 뚫고 “상단 밴드로 치고 올라가는 국면”**으로 해석됩니다. 가격 지수(KOSPI)·옵션·변동성 지표가 모두 동시에 긴장을 반영하고 있으므로 **‘국지적 쇼크가 아닌, 구조적으로 과열된 랠리에 대한 조정’**에 가까운 패턴입니다. 3. 뉴스·펀더멘털 맥락: 무엇이 공포를 키우는가? 3-1. 국내 요인 올해 세계 최고 수준의 랠리 → 과열 논쟁 여러 매체에 따르면 KOSPI는 올해 들어 +60~70%대 수익률 로 주요 지수 중 연간 1위 에 근접한 랠리를 기록 중입니다.( Bloomberg ) AI·반도체 랠리로 삼성전자, SK하이닉스 등 중대형주에 수급이 집중되며 파생상품과 레버리지 매매가 동반 확대 되고 있다는 지적이 나옵니다.( 조선비즈 ) AI 버블 우려 + 연속적인 급락 11월 5일과 21일 두 차례, 코스피는 각각 -2.9%, -3.8% 급락하며 “AI 버블 붕괴 우려”가 헤드라인을 장식했습니다.( KED Global ) 특히 21일 급락은 미국 기술주 조정과 동시 발생하며 외국인 순매도·프로그램 매도·공매도 증가 가 겹친 것으로 보도됩니다.( Financial Times ) 정책·당국 측 대응 시그널 한국 정부는 장기주식투자 인센티브·FX 안정대책 등 주식 및 환율 변동성 완화를 위한 정책 구상을 발표했습니다.( Reuters ) 과거에도 변동성이 과도하게 높아질 경우 당국이 “필요시 시장안정 조치”를 경고한 바 있습니다.( Reuters ) 3-2. 글로벌 요인 AI·기술주 밸류에이션 피로 미국·유럽 등지에서 “AI 버블”, “frothy valuations”라는 표현이 등장하며 주요 기술주가 조정을 받는 가운데, VIX가 11% 이상 급등하는 등 전 세계적으로 위험자산 선호가 약해지는 국면 입니다.( Financial Times ) 지정학·금리·경기 불확실성 일부 기사에서는 중동 긴장, 미국 군사행동, 이란 리스크 등을 VIX 25 상회 요인으로 지목하고, 향후 경제지표·연준 정책 경로 불확실성이 투자자들의 “리스크 오프”를 자극한다고 봅니다.( Roic ) 아시아 전체로 번지는 위험 회피 11월 들어 아시아 주요 증시에서 100억 달러 이상 외국인 순유출 이 발생, 특히 한국·대만에서 규모가 컸던 것으로 집계됩니다.( Reuters ) 정리 한국 시장만의 이슈라기보다는 **“세계적인 AI·테크 랠리 피로 + 한국 초강세 랠리의 후유증”**이 겹쳐서 나타나는 변동성 확대로 볼 수 있습니다. 4. 종합 평가: 현재 시장 위험 수준과 향후 시나리오 4-1. 현재 위험 수준 요약 지표 레벨 측면 KOSPI 변동성 지수: 최근 한 달 평균(35.9) 대비 +1.5σ, 상위 5% 구간 VIX: 20 → 26선 으로 점프, “긴장 모드” 진입 KOSPI GARCH 추정 변동성: 연중 상단 밴드 근처 시장 구조·수급 측면 레버리지·옵션(특히 VKOSPI·코스피200 옵션) 거래 급증 , 콜·풋 모두 프리미엄 확대가 관찰됨.( mint ) 외국인 자금의 **빠른 방향 전환(대규모 순매수 → 순매도)**와 프로그램 매도·공매도 증가. 심리 측면 헤드라인 키워드가 “AI 버블”, “레드 플래그”, “과열된 세계 1위 지수”로 바뀌며 탐욕 → 불안/경계 모드로 전환 된 상태.( Korea Joongang Daily ) 종합 등급: 금융위기·시스템 붕괴를 걱정할 수준은 아니지만, “높은 변동성의 조정 국면(High, not Extreme)” , 포지션 관리·리스크 관리에 최우선으로 집중해야 하는 단계 로 평가됩니다. 4-2. 향후 시나리오와 체크포인트 기본 시나리오 (확률 높음): “변동성 높은 박스/조정” VIX·VKOSPI가 단기간에 급등한 만큼, 뚜렷한 추가 악재가 없다면 기술적 바닥을 찾으며 점진적으로 하향 안정 될 가능성이 큽니다.( Investing.com ) 다만 코스피가 올해 너무 많이 오른 탓에 가격 조정(예: 고점 대비 10~15%) + 변동성 완만한 하락 조합이 가장 현실적인 그림입니다. 부정적 시나리오: “AI 버블 → 밸류에이션 리레이팅” 미국 기술주에서 실적/가이던스 미스 , 혹은 AI 투자 회수 가능성에 대한 회의가 본격화되면 고평가된 한국 반도체·플랫폼주에 대한 **밸류에이션 레벨 다운(멀티플 축소)**이 한 번 더 강하게 나올 수 있습니다. 이 경우 VKOSPI는 50pt 이상 도 열어 두어야 하는 구간입니다. 긍정적 시나리오: “연말 랠리 재개” AI 관련 실적이 다시 기대를 상회하고, 미국 금리·경기 지표가 “소프트랜딩” 그림을 재확인시켜 줄 경우 현재의 변동성 스파이크가 일시적 ‘세게 흔들기’ 후 재상승을 위한 조정 으로 기록될 수도 있습니다. 다만 이미 랠리가 길게 진행된 만큼, 이 시나리오에서도 변동성은 20대 초반까지 급락하기보다는 25~30대에서 잔존하는 구조적 변동성 상향 을 상정하는 편이 안전합니다. 4-3. 투자자 관점에서의 실무적 시사점 정보 제공 목적이며, 투자 판단과 손익은 전적으로 투자자 본인의 책임입니다. 레버리지·단기 매매 축소 현재 구간에서는 손절·마진콜 트리거가 쉽게 작동 할 수 있으므로 레버리지 비율을 줄이고 현금 비중을 일정 부분 유지하는 것이 합리적입니다. 헷지 전략 재점검 이미 풋옵션 가격이 많이 오른 상태라 새로운 풋 매수 헷지는 비용이 다소 비싸진 국면 입니다. 보유 주식이 크다면 OTM 풋 일부 매수, 콜 매도(커버드콜) 등 프리미엄을 활용한 헷지 를 검토할 수 있습니다. (구체적인 행사가·만기 선택은 포지션/리스크 선호도에 따라 별도 설계 필요) 포지션 선정 기준 실적·현금흐름이 뒷받침되는 대형주 중심으로, 변동성 스파이크 중에도 이익 추정치가 견조한 종목 위주로 노출을 유지하는 편이 리스크-리턴 관점에서 유리합니다. 테마형·무이익 성장주의 경우, 변동성 확대 국면에서 하락 베타가 1을 크게 상회 할 수 있으므로 비중 조절이 중요합니다. 요약하면, 지금 KOSPI 변동성은 “명백히 높다(High)” , 글로벌 쇼크 + 국내 과열 랠리의 후유증이 한꺼번에 나타나는 구간입니다. 다만 아직 “패닉”까지는 아니고, 리스크 관리만 잘 한다면 중장기 투자자에게는 좋은 가격 조정 구간이 될 여지도 있다 정도로 정리할 수 있습니다. 대충 이러함. 사라 마라 하는 건 아닌데 상황은 알고 들어가길 바람.",???: 곱버스도 국장이다. ||| 어엇?! ||| 위아래로발라먹는 고수들만이 지금 국장을 갈수있다 ||| 28일 금요일 오후4시 반대매매 나오는시간 ||| 옵션 만기 때문에 그러나? ||| 빛투... ||| 하락장 가능성이 크단 말이지... ||| 일단 시장에 걱정이 많긴 함 ||| 지수etf는 장기적으론 나쁘지않을꺼같긴한데..개별은.. ||| 미국은 지수가 올라가면 다들 지수 따라 오르내리는데 국장은 지수는 그냥 또 하나의 종목일 뿐이더라 ㅋㅋㅋ ||| 횡보란 위아래로 먹을수잇는 두배찬스란것 ||| ㅋㅋㅋㅋㅋㅋㅋㅋㅋㅋㅋㅋㅋㅋㅋㅋㅋ ||| 캬 파딱이 챙겨주는 주붕이 ||| 공포에 사라는데 아직 사는 사람들 있는거보면 공포도 아닌 느낌 ? 진짜 아무도 살 생각이 없어야 공포긴 해 ㅋㅋ ||| 그런가? ||| 나도 이번주는 지켜보자는 느낌이 좀 큼. 일단 금요일 좀 줍긴했는데 아직 불확실성이 없어진게 아니라서 이게 데드캣인지 뭔지 모르겠더라 ||| 솔직히 내년도 초까지는 걍 팔짱끼고 있을려함. ||| 정답 지금 당장 코덱스 선물 -2배로 사서 발라먹은 다음에 +2배로 롱을 탄다,stock,https://arca.live/b/stock/154712285?target=all&keyword=%EC%82%BC%EC%84%B1&p=2,arca,삼성
Title Hate,0.8854302708152904,154711116,,ARCALIVE,국장 분할상장한거 합해놓으면 존나 가관임,지금 분할상장된 상장사들을 다 합쳐서 알파벳같은 단일 지주사 1개라고 가정하면 한국 5대 그룹 (5개 기업으로 가정) 삼성: 23.8% SK: 14.4% 현대차: 5~6% LG: 4~5% HD현대: 4~5% 합계: 52.2% 5개 그룹만 합쳐놔도 코스피 절반 처먹음 코스피200을 산다는 것 = 사실상 얘네 5개 그룹을 사는 것이랑 마찬가지인 거 슨피도 M7 편중 심해서 위험하다고 하는데 저렇게 과반 넘고 그러진 않음,"삼성이 몇십개였더라 ||| Big 5 ㄷㄷㄷ ||| 재벌 재계 수준이 그렇죠 뭐 ||| M7 게 섯거라! 신토불이 M5, Many 5가 간다! ||| 아아 코스피를 위해 '분할'해준거다",stock,https://arca.live/b/stock/154711116?target=all&keyword=%EC%82%BC%EC%84%B1&p=2,arca,삼성
Title Hate,0.8670993525537174,154673150,,ARCALIVE,"美정부, 5G 주파수 추가할당 결정...글로벌 정책 촉각","FCC , 2027년까지 3.98~4.2GHz 대역 주파수 경매 완료 방침 미국 정부가 5G 주파수의 추가 할당에 대한 행정 절차를 본격화했다. 한국을 비롯해 세계 각국의 주파수 정책 대응이 불가피해졌다. 미국 연방통신위원회( FCC )는 늦어도 2027년 7월까지 C밴드 주파수 상위 대역, 즉 3.98~4.2GHz 대역에서 최소 100MHz 폭을 경매에 부치는 규칙 제정 절차를 만장일치로 의결했다. 2027년까지 최대 180MHz 폭의 주파수가 경매에 오를 수 있으며 2034년까지는 총 300MHz 폭의 주파수를 공급할 예정이다. 경매 방식은 앞서 공급한 3.7~3.98GHz 대역 280MHz 폭을 공급할 때 이뤄진 방식을 따른다는 방침이다. 앞서 5G 주파수를 공급하면서 108조 원의 경매 비용을 거둔 미국 정부도 5G 주파수 추가 할당에 고민이 깊었다. 먼저 항공기 고도계와 간섭 등의 문제가 발생했기 때문이다. 5G 주파수가 항공기 운용에 문제를 일으킨다는 지적이 제기됐고, 현재는 통신업계와 항공업계 간 논의가 활발해져 우려가 대폭 줄었다. 또 일론 머스크가 스페이스X의 스타링크 서비스를 위해 C밴드 주파수를 요구하며 충돌했으나 에코스타와 AWS-3 의 주파수를 인수하기로 하면서 관련한 고민도 사라졌다. 미국에서는 주파수 할당 대상 간에 이용권 인수와 매각이 가능하다. 올리비아 트러스티 FCC 위원은 “3.98~4.2GHz로 구성된 상부 C밴드는 차세대 무선 서비스 생태계를 확장할 수 있는 마지막 주요 중대역 주파수가 가진 기회 중 하나”라고 했다. 주목할 점은 미국이 향후 6G 서비스 지원을 포함해 5G 주파수 추가 할당을 공식화한 부분이다. 현재 6G 글로벌 표준 논의가 활발하게 시작됐고, 6G 시대에서 5G 통신의 역할에 대해 고민이 이뤄지고 있는 시점에 미국이 선제적으로 글로벌을 선도하고 나섰다는 설명이다. 글로벌 주파수 정책은 정치적으로 적대 관계에 있더라도 조화를 강조하는 하모니 정책 방향을 따르고 있다. 단순히 통신 서비스를 제공하는 이동통신사에 한정되는 게 아니라 삼성전자와 같이 스마트폰을 만들어 파는 제조사, 화웨이와 에릭슨 등 통신 장비 회사가 산업 생태계에 모두 엮여있기 때문이다.",흠... 버라이즌을 머스크가 인수하려나?,stock,https://arca.live/b/stock/154673150?target=all&keyword=%EC%82%BC%EC%84%B1&p=2,arca,삼성
Content Hate,0.8568368016926843,154582773,,ARCALIVE,딱 AI가 뭔지 비유해드림,지금 치니 골드러쉬가 발생한 상황 너도 나도 금광 찾아 가는데 정작 땅 속에 금이 있는 지는 모름 아니 가치는 있어도 돈이 되는지는 모름 (좀 많이 극단적인 비유로 님들 부모님은 가치 있는 사람들이지만 그걸 시장에 내다 팔진 못하잖아요) 그런데 너도 나도 달려가서 땅에 깃발이라도 꽂아야 함 그럼 여기서 돈을 버는 사람은 금광 찾으러 가는 사람이 아니라 금광 찾으러 가는 사람들에게 물건을 파는 사람임 삼성전자 매수하십시오,"골드러시와 다른 점은 금광 캐러 가는 사람들도 자기들만의 청바지와 곡괭이를 만들어내고 있다는 점임 ||| 뭔 소리임 청바지와 곡갱이가 엔비칩인데 ||| 삼전 파운드리로 만들겠네, 삼전매수 ||| 왜못팔아 ||| 오케이곡괭이카드파는엔비디아매수할게요 ||| 에게 재료 납품하는 삼성전자 ||| 알았어 알았다고 환율1500원 찍어도 엔디비아살게 ||| 그냥 곡갱이 파는 본주식  엔비디아 살게요",stock,https://arca.live/b/stock/154582773?target=all&keyword=%EC%82%BC%EC%84%B1&p=2,arca,삼성
