Reason,PHate,PostID,Comment,Site,Title,Content,Comments,GalleryID,PostURL,Source,Keyword
Content Hate,0.8758110309986671,154440684,,ARCALIVE,AI 가 좆망한다고 해도 원전은 가지 않을까?,일단 같이 쳐 맞은 다음에 말이지 ㅋㅋ cf. 11월 25일에는 삼성에서 운용하는 kodex 미국원자력smr ETF가 출범할 예정이다.,인버스ETF여?,stock,https://arca.live/b/stock/154440684?target=all&keyword=%EC%82%BC%EC%84%B1&p=2,arca,삼성
Comment Hate,0.9185613665907301,154433196,그거 ㄹㅇ임?   그냥 모의투자거거나  옵션에서 평단건드려서  구라로 나대는거 아닌가,,,,,,,,
Comment Hate,0.8807351343230264,154365081,곤조 안굽히고 개지랄한 게 꼴보기 싫어서 그럼.,,,,,,,,
Content Hate,0.8544702915175704,6641565,,DCINSIDE,이제 콜맨에게 마지막 희망은 다 운지 수뿐이다,희망을 버리지마라 나는 2박3일 무상급식캠프갔다올테니 [나는주식쟁이익절을모르는주갤럼] [뒺싶으로대동단결],,stock,https://gall.dcinside.com/board/view/?id=stock&no=6641565&page=1,dc,삼성
Title Hate,0.9298163272540153,6641559,,DCINSIDE,이전 주식 갤러리= 이화전기 주식 주주들만 사용하는 갤러리 란뜻이다,개잡주 산넘들 다꺼져 ㅋㅋㅋ 난 자랑스런 이화전기 주주임 참고로 오늘 화환가 으헠ㅋㅋ,,stock,https://gall.dcinside.com/board/view/?id=stock&no=6641559&page=1,dc,삼성
Comment Hate,0.8542190540757588,6641510,폐쇄 겠지 이 개멍청한 새끼야,,,,,,,,
Title Hate,0.8581939610983548,6641500,,DCINSIDE,이전 주식갤러리라면 지금은 주갤이 아니란뜻?ㅋㅋㅋ,현재 헬게이트 갤러리란 뜻?,주겔러들은 차캤습니다 ㅠㅠㅠㅠㅠㅠㅠㅠㅠㅠㅠㅠㅠㅠㅠ,stock,https://gall.dcinside.com/board/view/?id=stock&no=6641500&page=1,dc,삼성
